{"$defs":{"digest":{"pattern":"^[0-9a-f]{64}$","type":"string"},"event":{"additionalProperties":false,"properties":{"actor":{"$ref":"#/$defs/identifier"},"event_hash":{"$ref":"#/$defs/digest"},"execution_id":{"$ref":"#/$defs/identifier"},"graph_id":{"$ref":"#/$defs/graphDigest"},"kind":{"enum":["node_transition","output_recorded","evidence_recorded","approval_recorded","conflict_opened","conflict_resolved","side_effect_confirmed","node_invalidated"]},"node_id":{"oneOf":[{"$ref":"#/$defs/identifier"},{"type":"null"}]},"payload":true,"previous_event_hash":{"oneOf":[{"$ref":"#/$defs/digest"},{"type":"null"}]},"sequence":{"minimum":1,"type":"integer"}},"required":["actor","event_hash","execution_id","graph_id","kind","node_id","payload","previous_event_hash","sequence"],"type":"object"},"graphDigest":{"pattern":"^sha256:[0-9a-f]{64}$","type":"string"},"identifier":{"maxLength":160,"pattern":"^[a-z][a-z0-9]*(?:_[a-z0-9]+)*$","type":"string"}},"$id":"urn:graph-native-agent-control-plane:schema:execution-record:0.1.0","$schema":"https://json-schema.org/draft/2020-12/schema","additionalProperties":false,"properties":{"completion":{"additionalProperties":false,"properties":{"authorized":{"type":"boolean"},"blockers":{"items":{"type":"string"},"type":"array","uniqueItems":true},"outcome":{"enum":[null,"success","partial","blocked","failed","refused","exhausted","cancelled"]}},"required":["authorized","blockers","outcome"],"type":"object"},"events":{"items":{"$ref":"#/$defs/event"},"type":"array"},"execution_id":{"$ref":"#/$defs/identifier"},"graph_id":{"$ref":"#/$defs/graphDigest"},"kind":{"const":"graph_native_execution_record_v1"}},"required":["completion","events","execution_id","graph_id","kind"],"title":"Graph-Native Agent Control Plane Execution Record","type":"object"}
