{"completion":{"authorized":true,"blockers":[],"outcome":"success"},"events":[{"actor":"orchestrator","event_hash":"a531a287540d6d8b672cb2fb2b6ce1abf2e3995979415f88a9df8ebcf784b1a2","execution_id":"example_execution","graph_id":"sha256:0408721ce5b5c789e314e9038b2e376c521b23245b117251b3dd648c895918c9","kind":"node_transition","node_id":"agent","payload":{"to":"eligible"},"previous_event_hash":null,"sequence":1},{"actor":"orchestrator","event_hash":"c3f4f310071874d9fc0a97f2b2e2dc14a6e7b4797cca7b6b38481d9ccb99c14c","execution_id":"example_execution","graph_id":"sha256:0408721ce5b5c789e314e9038b2e376c521b23245b117251b3dd648c895918c9","kind":"node_transition","node_id":"agent","payload":{"to":"activated"},"previous_event_hash":"a531a287540d6d8b672cb2fb2b6ce1abf2e3995979415f88a9df8ebcf784b1a2","sequence":2},{"actor":"orchestrator","event_hash":"61cb6481aed95f0216c2e3b6e781a5ee92320e932b78a427286851afbd46fc07","execution_id":"example_execution","graph_id":"sha256:0408721ce5b5c789e314e9038b2e376c521b23245b117251b3dd648c895918c9","kind":"node_transition","node_id":"agent","payload":{"to":"running"},"previous_event_hash":"c3f4f310071874d9fc0a97f2b2e2dc14a6e7b4797cca7b6b38481d9ccb99c14c","sequence":3},{"actor":"agent","event_hash":"5852e613e231f377348effded927a0fc1781df52cbf9e4f1e4fdef0da429c351","execution_id":"example_execution","graph_id":"sha256:0408721ce5b5c789e314e9038b2e376c521b23245b117251b3dd648c895918c9","kind":"output_recorded","node_id":"agent","payload":{"node":"agent","objective":"Return every valid result."},"previous_event_hash":"61cb6481aed95f0216c2e3b6e781a5ee92320e932b78a427286851afbd46fc07","sequence":4},{"actor":"orchestrator","event_hash":"cd0510ea00dc4d5115b5cc28adcace6287dc639e6de632003e811a444a114fc7","execution_id":"example_execution","graph_id":"sha256:0408721ce5b5c789e314e9038b2e376c521b23245b117251b3dd648c895918c9","kind":"node_transition","node_id":"agent","payload":{"to":"produced"},"previous_event_hash":"5852e613e231f377348effded927a0fc1781df52cbf9e4f1e4fdef0da429c351","sequence":5},{"actor":"orchestrator","event_hash":"ea44d82cc5185a8bb891a57498758e45e9a5d8244dc1e44605d192edfec516be","execution_id":"example_execution","graph_id":"sha256:0408721ce5b5c789e314e9038b2e376c521b23245b117251b3dd648c895918c9","kind":"node_transition","node_id":"agent","payload":{"to":"validating"},"previous_event_hash":"cd0510ea00dc4d5115b5cc28adcace6287dc639e6de632003e811a444a114fc7","sequence":6},{"actor":"orchestrator","event_hash":"493e0f2419f13ff5d2fb6a3b9502847ed157b0960dd7ba6168ff7d412b2e26a6","execution_id":"example_execution","graph_id":"sha256:0408721ce5b5c789e314e9038b2e376c521b23245b117251b3dd648c895918c9","kind":"node_transition","node_id":"agent","payload":{"to":"accepted"},"previous_event_hash":"ea44d82cc5185a8bb891a57498758e45e9a5d8244dc1e44605d192edfec516be","sequence":7},{"actor":"orchestrator","event_hash":"df9932cf1ed6efd66fddcbd2de1cda65603d43e678b035910a35318a54faaaa2","execution_id":"example_execution","graph_id":"sha256:0408721ce5b5c789e314e9038b2e376c521b23245b117251b3dd648c895918c9","kind":"node_transition","node_id":"quality","payload":{"to":"eligible"},"previous_event_hash":"493e0f2419f13ff5d2fb6a3b9502847ed157b0960dd7ba6168ff7d412b2e26a6","sequence":8},{"actor":"orchestrator","event_hash":"201f2a848346487879f3bd1a57051e0b9171dde9ee34754575777213933081b1","execution_id":"example_execution","graph_id":"sha256:0408721ce5b5c789e314e9038b2e376c521b23245b117251b3dd648c895918c9","kind":"node_transition","node_id":"quality","payload":{"to":"activated"},"previous_event_hash":"df9932cf1ed6efd66fddcbd2de1cda65603d43e678b035910a35318a54faaaa2","sequence":9},{"actor":"orchestrator","event_hash":"4a34ce3e861107d512d9fe2572f830b408827716701c17b9a50e319688ea8f49","execution_id":"example_execution","graph_id":"sha256:0408721ce5b5c789e314e9038b2e376c521b23245b117251b3dd648c895918c9","kind":"node_transition","node_id":"quality","payload":{"to":"running"},"previous_event_hash":"201f2a848346487879f3bd1a57051e0b9171dde9ee34754575777213933081b1","sequence":10},{"actor":"quality","event_hash":"a70dd19e5ab54caf4af561b28b1ae982bae1d335fa3fc7009d21986da6b08f0b","execution_id":"example_execution","graph_id":"sha256:0408721ce5b5c789e314e9038b2e376c521b23245b117251b3dd648c895918c9","kind":"output_recorded","node_id":"quality","payload":{"findings":[],"passed":true},"previous_event_hash":"4a34ce3e861107d512d9fe2572f830b408827716701c17b9a50e319688ea8f49","sequence":11},{"actor":"orchestrator","event_hash":"07ecf544261ce60a5b3900ceb9d75d7c397a35c279e6e451340328e24e70fb8d","execution_id":"example_execution","graph_id":"sha256:0408721ce5b5c789e314e9038b2e376c521b23245b117251b3dd648c895918c9","kind":"node_transition","node_id":"quality","payload":{"to":"produced"},"previous_event_hash":"a70dd19e5ab54caf4af561b28b1ae982bae1d335fa3fc7009d21986da6b08f0b","sequence":12},{"actor":"orchestrator","event_hash":"accfa7d7ad4a9a6821c701fd3cd338e9d1062a2fb277d9e6de8fc342957d0ba5","execution_id":"example_execution","graph_id":"sha256:0408721ce5b5c789e314e9038b2e376c521b23245b117251b3dd648c895918c9","kind":"node_transition","node_id":"quality","payload":{"to":"validating"},"previous_event_hash":"07ecf544261ce60a5b3900ceb9d75d7c397a35c279e6e451340328e24e70fb8d","sequence":13},{"actor":"orchestrator","event_hash":"af406e40b03d993cfb43689000189faf24af013a200f1c1cca8aa371f0cbb777","execution_id":"example_execution","graph_id":"sha256:0408721ce5b5c789e314e9038b2e376c521b23245b117251b3dd648c895918c9","kind":"node_transition","node_id":"quality","payload":{"to":"accepted"},"previous_event_hash":"accfa7d7ad4a9a6821c701fd3cd338e9d1062a2fb277d9e6de8fc342957d0ba5","sequence":14}],"execution_id":"example_execution","graph_id":"sha256:0408721ce5b5c789e314e9038b2e376c521b23245b117251b3dd648c895918c9","kind":"graph_native_execution_record_v1"}
